{
  "approved_late_stage_native": [],
  "approved_native_universe": [
    {
      "build_context_id": "code-c-pyinstaller-0081732df8b12e4167caf404f83204c1",
      "entry_id": "approved-wheel-0001-e171163e1135",
      "internal_path": "numpy.libs/libscipy_openblas64_-9e3e5a4229c1ca39f10dc82bba9e2b2b.dll",
      "owner_kind": "WHEEL_OWNED_NATIVE",
      "payload_sha256": "9e3e5a4229c1ca39f10dc82bba9e2b2bf48037790932566f37aff1a7ccf3588f",
      "source_artifact_id": "wheel-pkg:pypi-numpy-2.3.5",
      "source_artifact_sha256": "00dc4e846108a382c5869e77c6ed514394bdeb3403461d25a829711041217d5b",
      "source_path": "numpy.libs/libscipy_openblas64_-9e3e5a4229c1ca39f10dc82bba9e2b2b.dll",
      "target": {
        "architecture": "x86_64",
        "os": "windows",
        "python_version": "3.13.15"
      }
    },
    {
      "build_context_id": "code-c-pyinstaller-0081732df8b12e4167caf404f83204c1",
      "entry_id": "approved-wheel-0002-67d4545a2919",
      "internal_path": "numpy.libs/msvcp140-a4c2229bdc2a2a630acdc095b4d86008.dll",
      "owner_kind": "WHEEL_OWNED_NATIVE",
      "payload_sha256": "a4c2229bdc2a2a630acdc095b4d86008e5c3e3bc7773174354f3da4f5beb9cde",
      "source_artifact_id": "wheel-pkg:pypi-numpy-2.3.5",
      "source_artifact_sha256": "00dc4e846108a382c5869e77c6ed514394bdeb3403461d25a829711041217d5b",
      "source_path": "numpy.libs/msvcp140-a4c2229bdc2a2a630acdc095b4d86008.dll",
      "target": {
        "architecture": "x86_64",
        "os": "windows",
        "python_version": "3.13.15"
      }
    },
    {
      "build_context_id": "code-c-pyinstaller-0081732df8b12e4167caf404f83204c1",
      "entry_id": "approved-wheel-0003-8b92ba9e009e",
      "internal_path": "numpy/_core/_multiarray_tests.cp313-win_amd64.pyd",
      "owner_kind": "WHEEL_OWNED_NATIVE",
      "payload_sha256": "181efbd14d98fc4ccf96fc5c274fb7c85294e263a93320d8f261eb36881a9000",
      "source_artifact_id": "wheel-pkg:pypi-numpy-2.3.5",
      "source_artifact_sha256": "00dc4e846108a382c5869e77c6ed514394bdeb3403461d25a829711041217d5b",
      "source_path": "numpy/_core/_multiarray_tests.cp313-win_amd64.pyd",
      "target": {
        "architecture": "x86_64",
        "os": "windows",
        "python_version": "3.13.15"
      }
    },
    {
      "build_context_id": "code-c-pyinstaller-0081732df8b12e4167caf404f83204c1",
      "entry_id": "approved-wheel-0004-46ff322bdfe5",
      "internal_path": "numpy/_core/_multiarray_umath.cp313-win_amd64.pyd",
      "owner_kind": "WHEEL_OWNED_NATIVE",
      "payload_sha256": "04a87dcb37e46eff7b931a45e6d87366ede144b5ff319070a2cb983a9b2e1bbc",
      "source_artifact_id": "wheel-pkg:pypi-numpy-2.3.5",
      "source_artifact_sha256": "00dc4e846108a382c5869e77c6ed514394bdeb3403461d25a829711041217d5b",
      "source_path": "numpy/_core/_multiarray_umath.cp313-win_amd64.pyd",
      "target": {
        "architecture": "x86_64",
        "os": "windows",
        "python_version": "3.13.15"
      }
    },
    {
      "build_context_id": "code-c-pyinstaller-0081732df8b12e4167caf404f83204c1",
      "entry_id": "approved-wheel-0005-4ebe46064e48",
      "internal_path": "numpy/_core/_operand_flag_tests.cp313-win_amd64.pyd",
      "owner_kind": "WHEEL_OWNED_NATIVE",
      "payload_sha256": "28560c499d8c3086be7db1438e68824337c4c5e3df27d9e67101333d57d28857",
      "source_artifact_id": "wheel-pkg:pypi-numpy-2.3.5",
      "source_artifact_sha256": "00dc4e846108a382c5869e77c6ed514394bdeb3403461d25a829711041217d5b",
      "source_path": "numpy/_core/_operand_flag_tests.cp313-win_amd64.pyd",
      "target": {
        "architecture": "x86_64",
        "os": "windows",
        "python_version": "3.13.15"
      }
    },
    {
      "build_context_id": "code-c-pyinstaller-0081732df8b12e4167caf404f83204c1",
      "entry_id": "approved-wheel-0006-f14d4e511419",
      "internal_path": "numpy/_core/_rational_tests.cp313-win_amd64.pyd",
      "owner_kind": "WHEEL_OWNED_NATIVE",
      "payload_sha256": "1400cb24611534b26d9ae7efd326cf99ab35fd59eea6f42cda567f6be70ea9b0",
      "source_artifact_id": "wheel-pkg:pypi-numpy-2.3.5",
      "source_artifact_sha256": "00dc4e846108a382c5869e77c6ed514394bdeb3403461d25a829711041217d5b",
      "source_path": "numpy/_core/_rational_tests.cp313-win_amd64.pyd",
      "target": {
        "architecture": "x86_64",
        "os": "windows",
        "python_version": "3.13.15"
      }
    },
    {
      "build_context_id": "code-c-pyinstaller-0081732df8b12e4167caf404f83204c1",
      "entry_id": "approved-wheel-0007-43c2e38e8e74",
      "internal_path": "numpy/_core/_simd.cp313-win_amd64.pyd",
      "owner_kind": "WHEEL_OWNED_NATIVE",
      "payload_sha256": "29c67076acce4e18996e318ea5b8ce62667e5135fcbeb47d0db57a0567e47e80",
      "source_artifact_id": "wheel-pkg:pypi-numpy-2.3.5",
      "source_artifact_sha256": "00dc4e846108a382c5869e77c6ed514394bdeb3403461d25a829711041217d5b",
      "source_path": "numpy/_core/_simd.cp313-win_amd64.pyd",
      "target": {
        "architecture": "x86_64",
        "os": "windows",
        "python_version": "3.13.15"
      }
    },
    {
      "build_context_id": "code-c-pyinstaller-0081732df8b12e4167caf404f83204c1",
      "entry_id": "approved-wheel-0008-0806071f3c2b",
      "internal_path": "numpy/_core/_struct_ufunc_tests.cp313-win_amd64.pyd",
      "owner_kind": "WHEEL_OWNED_NATIVE",
      "payload_sha256": "fc8c492d7e590d6924bbabd5f6ecdf6a4e7226cf36a68c9b52d9ef686c766f27",
      "source_artifact_id": "wheel-pkg:pypi-numpy-2.3.5",
      "source_artifact_sha256": "00dc4e846108a382c5869e77c6ed514394bdeb3403461d25a829711041217d5b",
      "source_path": "numpy/_core/_struct_ufunc_tests.cp313-win_amd64.pyd",
      "target": {
        "architecture": "x86_64",
        "os": "windows",
        "python_version": "3.13.15"
      }
    },
    {
      "build_context_id": "code-c-pyinstaller-0081732df8b12e4167caf404f83204c1",
      "entry_id": "approved-wheel-0009-cd6165cc458d",
      "internal_path": "numpy/_core/_umath_tests.cp313-win_amd64.pyd",
      "owner_kind": "WHEEL_OWNED_NATIVE",
      "payload_sha256": "575c613565707e94d1ffa975aa2a5f96ded5c02bbe35941206fa7fdbe687b732",
      "source_artifact_id": "wheel-pkg:pypi-numpy-2.3.5",
      "source_artifact_sha256": "00dc4e846108a382c5869e77c6ed514394bdeb3403461d25a829711041217d5b",
      "source_path": "numpy/_core/_umath_tests.cp313-win_amd64.pyd",
      "target": {
        "architecture": "x86_64",
        "os": "windows",
        "python_version": "3.13.15"
      }
    },
    {
      "build_context_id": "code-c-pyinstaller-0081732df8b12e4167caf404f83204c1",
      "entry_id": "approved-wheel-0010-ac530369c632",
      "internal_path": "numpy/fft/_pocketfft_umath.cp313-win_amd64.pyd",
      "owner_kind": "WHEEL_OWNED_NATIVE",
      "payload_sha256": "450931b90eabbb64b3f7936f06ee95250fb5b9d1c06cf3892efed36c025909e8",
      "source_artifact_id": "wheel-pkg:pypi-numpy-2.3.5",
      "source_artifact_sha256": "00dc4e846108a382c5869e77c6ed514394bdeb3403461d25a829711041217d5b",
      "source_path": "numpy/fft/_pocketfft_umath.cp313-win_amd64.pyd",
      "target": {
        "architecture": "x86_64",
        "os": "windows",
        "python_version": "3.13.15"
      }
    },
    {
      "build_context_id": "code-c-pyinstaller-0081732df8b12e4167caf404f83204c1",
      "entry_id": "approved-wheel-0011-731886d426c7",
      "internal_path": "numpy/linalg/_umath_linalg.cp313-win_amd64.pyd",
      "owner_kind": "WHEEL_OWNED_NATIVE",
      "payload_sha256": "ce9c95c3836521e26f4b34d71ad89ddc8e945fe72a2016f8b339999c6fb0edf4",
      "source_artifact_id": "wheel-pkg:pypi-numpy-2.3.5",
      "source_artifact_sha256": "00dc4e846108a382c5869e77c6ed514394bdeb3403461d25a829711041217d5b",
      "source_path": "numpy/linalg/_umath_linalg.cp313-win_amd64.pyd",
      "target": {
        "architecture": "x86_64",
        "os": "windows",
        "python_version": "3.13.15"
      }
    },
    {
      "build_context_id": "code-c-pyinstaller-0081732df8b12e4167caf404f83204c1",
      "entry_id": "approved-wheel-0012-09e7d253681b",
      "internal_path": "numpy/linalg/lapack_lite.cp313-win_amd64.pyd",
      "owner_kind": "WHEEL_OWNED_NATIVE",
      "payload_sha256": "f035059e2922723770f8c60af58e054102a0fb09c0b3455ee23fd95e2bd28f2a",
      "source_artifact_id": "wheel-pkg:pypi-numpy-2.3.5",
      "source_artifact_sha256": "00dc4e846108a382c5869e77c6ed514394bdeb3403461d25a829711041217d5b",
      "source_path": "numpy/linalg/lapack_lite.cp313-win_amd64.pyd",
      "target": {
        "architecture": "x86_64",
        "os": "windows",
        "python_version": "3.13.15"
      }
    },
    {
      "build_context_id": "code-c-pyinstaller-0081732df8b12e4167caf404f83204c1",
      "entry_id": "approved-wheel-0013-92eeca8ea1e2",
      "internal_path": "numpy/random/_bounded_integers.cp313-win_amd64.pyd",
      "owner_kind": "WHEEL_OWNED_NATIVE",
      "payload_sha256": "5423456cf271a96c9bf8376d5a49634465f393a681b8f29f0039a2206c542de6",
      "source_artifact_id": "wheel-pkg:pypi-numpy-2.3.5",
      "source_artifact_sha256": "00dc4e846108a382c5869e77c6ed514394bdeb3403461d25a829711041217d5b",
      "source_path": "numpy/random/_bounded_integers.cp313-win_amd64.pyd",
      "target": {
        "architecture": "x86_64",
        "os": "windows",
        "python_version": "3.13.15"
      }
    },
    {
      "build_context_id": "code-c-pyinstaller-0081732df8b12e4167caf404f83204c1",
      "entry_id": "approved-wheel-0014-1d08a88f6044",
      "internal_path": "numpy/random/_common.cp313-win_amd64.pyd",
      "owner_kind": "WHEEL_OWNED_NATIVE",
      "payload_sha256": "db844232c16284032a353198f3606416ee1b7768ca46286e91819d34f645e627",
      "source_artifact_id": "wheel-pkg:pypi-numpy-2.3.5",
      "source_artifact_sha256": "00dc4e846108a382c5869e77c6ed514394bdeb3403461d25a829711041217d5b",
      "source_path": "numpy/random/_common.cp313-win_amd64.pyd",
      "target": {
        "architecture": "x86_64",
        "os": "windows",
        "python_version": "3.13.15"